{
  "checked_at": "2026-04-02T10:10:25Z",
  "condition_set_ref": "condition-set-v1-second-proof-slice-threshold-validation",
  "outcome": "pass",
  "reason_refs": [
    "reason-v1-bounded-input-present",
    "reason-v1-bounded-threshold-satisfied"
  ],
  "related_witness_ref": "witness-aa09e1ff8cc24e93839c6d20175cf51b",
  "target_ref": "matter-18e7dde8ddd0455dae6dc25b29a84908",
  "validation_id": "validation-d34b085b6eb1471791710db828dc44d5",
  "validation_type": "threshold_validation"
}
