{
  "checked_at": "2026-04-01T20:15:39Z",
  "condition_set_ref": "condition-set-v1-first-proof-slice-threshold-validation",
  "outcome": "pass",
  "reason_refs": [
    "reason-v1-bounded-input-present",
    "reason-v1-bounded-threshold-satisfied"
  ],
  "related_witness_ref": "witness-21b189a37b9e44f0915135b6aa0cce31",
  "target_ref": "matter-3ce8d00d4a614161a2fec07aeb4ff282",
  "validation_id": "validation-7218a89d58ce4933bc437ef66ea9a7de",
  "validation_type": "threshold_validation"
}
