{
  "checked_at": "2026-04-02T11:55:29Z",
  "condition_set_ref": "condition-set-v1-fourth-proof-slice-threshold-validation",
  "outcome": "pass",
  "reason_refs": [
    "reason-v1-bounded-input-present",
    "reason-v1-bounded-threshold-satisfied"
  ],
  "related_witness_ref": "witness-99d31baf23e84762b46a0fa81e829b6b",
  "target_ref": "matter-e70f5dc0b1e94b6dbc37e9d347a591bc",
  "validation_id": "validation-ff3bfec5eafc4bcb9fd38556e577ab73",
  "validation_type": "threshold_validation"
}
